Name,Slug,Collection ID,Locale ID,Item ID,Created On,Updated On,Published On,Serp titulo,Serp metadescription,<h1>,1ª <h2>,2ª <h2>,Parágrafo destaque,1º paragráfo,2º paragráfo,NOVO paragrafo destaque,NOVO 1º Parágrafo,NOVO 2º Parágrafo
Acidente de Trabalho,acidente-de-trabalho,65c413ba50d21de863daa711,6552987bfd4a5980b0cc5b42,65c4160bba39bd0ce7b6250a,Wed Feb 07 2024 23:45:15 GMT+0000 (Coordinated Universal Time),Wed Feb 07 2024 23:45:15 GMT+0000 (Coordinated Universal Time),Wed Feb 07 2024 23:46:49 GMT+0000 (Coordinated Universal Time),Acidente de Trabalho,,Acidente de Trabalho Defenda seus direitos!,,,,,,,,
Acordo Trabalhista,acordo-trabalhista,65c413ba50d21de863daa711,6552987bfd4a5980b0cc5b42,65c4160b5f0a64e1b6caa011,Wed Feb 07 2024 23:45:15 GMT+0000 (Coordinated Universal Time),Wed Feb 07 2024 23:45:15 GMT+0000 (Coordinated Universal Time),Wed Feb 07 2024 23:46:49 GMT+0000 (Coordinated Universal Time),Acordo Trabalhista,,Acordo Trabalhista Defenda seus direitos!,,,,,,,,
Direitos Trabalhistas do Açougueiro,acougueiro,65c413ba50d21de863daa711,6552987bfd4a5980b0cc5b42,65c4160c7ac909294ce95a88,Wed Feb 07 2024 23:45:16 GMT+0000 (Coordinated Universal Time),Wed Feb 07 2024 23:45:16 GMT+0000 (Coordinated Universal Time),Wed Feb 07 2024 23:46:49 GMT+0000 (Coordinated Universal Time),Direitos Trabalhistas do Açougueiro,"Se você é um açougueiro e enfrenta desafios no local de trabalho, saiba que você não está sozinho. Na Quero DIreito, estamos comprometidos em proteger seus direitos e garantir que você seja tratado com justiça. Podemos ajudá-lo em casos de horas extras não remuneradas, jornada irregular, exposição à insalubridade e muito mais.",Direitos Trabalhistas do Açougueiro,Segurança,ADVOGADO PARA SEGURANÇA,"Se você é um açougueiro e enfrenta desafios no local de trabalho, saiba que você não está sozinho. Na Quero DIreito, estamos comprometidos em proteger seus direitos e garantir que você seja tratado com justiça. Podemos ajudá-lo em casos de horas extras não remuneradas, jornada irregular, exposição à insalubridade e muito mais.","Atua como segurança e tem questões no trabalho? Através de nossa plataforma, você pode encontrar advogados especializados em direitos trabalhistas de seguranças. Seja para tratar de horas de trabalho além do permitido, falta de adicional noturno ou condições inseguras, estamos aqui para facilitar o acesso à ajuda. Conheça seus direitos em <advogados online>.",Quem trabalha como segurança pode ter direitos omitidos nas verbas rescisórias. Tire suas dúvidas e converse com os melhores advogados em causas trabalhistas para seguranças.,,,
Advogado Trabalhista,advogado-trabalhista,65c413ba50d21de863daa711,6552987bfd4a5980b0cc5b42,65c4160a79e30f10b2e87e83,Wed Feb 07 2024 23:45:14 GMT+0000 (Coordinated Universal Time),Wed Feb 07 2024 23:45:14 GMT+0000 (Coordinated Universal Time),Wed Feb 07 2024 23:46:49 GMT+0000 (Coordinated Universal Time),Advogado Trabalhista,,Advogado Trabalhista Defenda seus direitos!,,,,,,,,
Assédio Moral no Trabalho,assedio-moral,65c413ba50d21de863daa711,6552987bfd4a5980b0cc5b42,65c4160d7c6a4c1061b0a7f4,Wed Feb 07 2024 23:45:17 GMT+0000 (Coordinated Universal Time),Wed Feb 07 2024 23:45:17 GMT+0000 (Coordinated Universal Time),Wed Feb 07 2024 23:46:49 GMT+0000 (Coordinated Universal Time),Assédio Moral no Trabalho,Você não precisa enfrentar sozinho o dilema do assédio moral no ambiente de trabalho. Nossos advogados especializados em direito trabalhista têm ampla experiência em lidar com casos de assédio moral no ambiente de trabalho.,Assédio Moral no Trabalho,Vigia,ADVOGADO PARA VIGIA,Você não precisa enfrentar sozinho o dilema do assédio moral no ambiente de trabalho. Nossos advogados especializados em direito trabalhista têm ampla experiência em lidar com casos de assédio moral no ambiente de trabalho.,Atua como vigia e se depara com problemas no trabalho? Nossa plataforma permite que você se conecte com advogados focados em direitos trabalhistas de vigias. Enfrente questões como jornadas longas sem compensação adequada e falta de equipamento com o suporte certo. Acesse <advogados online> e conheça seus direitos.,Quem trabalha como vigia pode ter direitos não abordados nas verbas rescisórias. Tire suas dúvidas e fale com os melhores advogados em causas trabalhistas para vigias.,,,
Direitos Trabalhistas do Auxiliar de Limpeza,auxiliar-de-limpeza,65c413ba50d21de863daa711,6552987bfd4a5980b0cc5b42,65c4160de82613df1c5ab2fd,Wed Feb 07 2024 23:45:17 GMT+0000 (Coordinated Universal Time),Wed Feb 07 2024 23:45:17 GMT+0000 (Coordinated Universal Time),Wed Feb 07 2024 23:46:49 GMT+0000 (Coordinated Universal Time),Direitos Trabalhistas do Auxiliar de Limpeza,"Sabemos que muitas vezes os auxiliares de limpeza enfrentam desafios únicos no local de trabalho. Seja por não receberem salários justos, por trabalharem horas extras não remuneradas, ou por terem seus direitos básicos ignorados, essas situações podem fazer com que você se sinta desvalorizada e impotente. Na Quero Direito podemos te ajudar.",Direitos Trabalhistas do Auxiliar de Limpeza,Bancário,ADVOGADO PARA BANCÁRIO,"Sabemos que muitas vezes os auxiliares de limpeza enfrentam desafios únicos no local de trabalho. Seja por não receberem salários justos, por trabalharem horas extras não remuneradas, ou por terem seus direitos básicos ignorados, essas situações podem fazer com que você se sinta desvalorizada e impotente. Na Quero Direito podemos te ajudar.","É bancário e enfrenta situações adversas no emprego? Nossa plataforma oferece acesso a advogados focados em direitos dos bancários. Discuta metas abusivas, horas extras não pagas ou assédio moral com profissionais qualificados. Visite <advogados online> para conhecer mais sobre seus direitos.",Quem trabalha no setor bancário pode ter direitos não incluídos nas verbas rescisórias. Tire suas dúvidas e fale com os melhores advogados em causas trabalhistas para bancários.,,,
Direitos Trabalhistas de Bancários,bancarios,65c413ba50d21de863daa711,6552987bfd4a5980b0cc5b42,65c4160caa11ef67a527643a,Wed Feb 07 2024 23:45:16 GMT+0000 (Coordinated Universal Time),Wed Feb 07 2024 23:45:16 GMT+0000 (Coordinated Universal Time),Wed Feb 07 2024 23:46:49 GMT+0000 (Coordinated Universal Time),Direitos Trabalhistas de Bancários,"Bancários desempenham um papel crucial no setor financeiro e têm direitos trabalhistas específicos que devem ser conhecidos e respeitados. Estes direitos incluem uma jornada de trabalho definida, remuneração justa, horas extras remuneradas, férias remuneradas, participação nos lucros e resultados (PLR), estabilidade provisória em certas situações, direitos sindicais e muito mais.",Direitos Trabalhistas de Bancários,Motoboy,ADVOGADO PARA MOTOBOY,"Bancários desempenham um papel crucial no setor financeiro e têm direitos trabalhistas específicos que devem ser conhecidos e respeitados. Estes direitos incluem uma jornada de trabalho definida, remuneração justa, horas extras remuneradas, férias remuneradas, participação nos lucros e resultados (PLR), estabilidade provisória em certas situações, direitos sindicais e muito mais.","Trabalha como motoboy e enfrenta desafios? Encontre advogados com experiência em direitos trabalhistas de motoboys na nossa plataforma. Se estiver lidando com remuneração inadequada, jornadas excessivas ou falta de equipamento de segurança, podemos ajudar. Conecte-se com <advogados online> e explore seus direitos.",Quem trabalha como motoboy pode ter direitos ausentes nas verbas rescisórias. Tire suas dúvidas e converse com os melhores advogados em causas trabalhistas para motoboys.,,,
Cálculo de Rescisão,calculo-rescisao,65c413ba50d21de863daa711,6552987bfd4a5980b0cc5b42,65c4160a50240dae492d43b0,Wed Feb 07 2024 23:45:14 GMT+0000 (Coordinated Universal Time),Wed Feb 07 2024 23:45:14 GMT+0000 (Coordinated Universal Time),Wed Feb 07 2024 23:46:49 GMT+0000 (Coordinated Universal Time),Cálculo de Rescisão,,Cálculo de Rescisão Defenda seus direitos!,,,,,,,,
Danos Morais no Trabalho,danos-morais,65c413ba50d21de863daa711,6552987bfd4a5980b0cc5b42,65c4160dddce6cf72de89806,Wed Feb 07 2024 23:45:17 GMT+0000 (Coordinated Universal Time),Wed Feb 07 2024 23:45:17 GMT+0000 (Coordinated Universal Time),Wed Feb 07 2024 23:46:49 GMT+0000 (Coordinated Universal Time),Danos Morais no Trabalho,Você não precisa enfrentar sozinho o dilema dos danos morais ou assédio moral no ambiente de trabalho. Nossos advogados especializados em direito trabalhista têm ampla experiência em lidar com casos de danos morais e assédio moral no ambiente de trabalho.,Danos Morais no Trabalho,Diarista,ADVOGADO PARA DIARISTA,Você não precisa enfrentar sozinho o dilema dos danos morais ou assédio moral no ambiente de trabalho. Nossos advogados especializados em direito trabalhista têm ampla experiência em lidar com casos de danos morais e assédio moral no ambiente de trabalho.,"É diarista e tem dificuldades trabalhistas? Utilize nossa plataforma para acessar advogados especializados nos direitos de diaristas. Se enfrenta problemas como falta de reconhecimento de vínculo, pagamento abaixo do combinado ou ausência de direitos, estamos aqui para ajudar. Visite <advogados online> e saiba mais sobre seus direitos.",Quem trabalha como diarista pode ter direitos não considerados nas verbas rescisórias. Tire suas dúvidas e converse com os melhores advogados em causas trabalhistas para diaristas.,,,
Demissão,demissao,65c413ba50d21de863daa711,6552987bfd4a5980b0cc5b42,65c4160ae56d80f87a709779,Wed Feb 07 2024 23:45:14 GMT+0000 (Coordinated Universal Time),Wed Feb 07 2024 23:45:14 GMT+0000 (Coordinated Universal Time),Wed Feb 07 2024 23:46:49 GMT+0000 (Coordinated Universal Time),Demissão,Sofreu uma demissão injusta? Defenda seus direitos!,Demissão Defenda seus direitos!,,,Sofreu uma demissão injusta? Defenda seus direitos!,,,,,
Acúmulo / Desvio de Função,desvio-de-funcao,65c413ba50d21de863daa711,6552987bfd4a5980b0cc5b42,65c4160c50d21de863dc3161,Wed Feb 07 2024 23:45:16 GMT+0000 (Coordinated Universal Time),Wed Feb 07 2024 23:45:16 GMT+0000 (Coordinated Universal Time),Wed Feb 07 2024 23:46:49 GMT+0000 (Coordinated Universal Time),Acúmulo / Desvio de Função,,Acúmulo / Desvio de Função Defenda seus direitos!,,,,,,,,
Direitos Trabalhistas,direito-trabalhista,65c413ba50d21de863daa711,6552987bfd4a5980b0cc5b42,65c4160ad26c6ed395390f7a,Wed Feb 07 2024 23:45:14 GMT+0000 (Coordinated Universal Time),Wed Feb 07 2024 23:45:14 GMT+0000 (Coordinated Universal Time),Wed Feb 07 2024 23:46:49 GMT+0000 (Coordinated Universal Time),Direitos Trabalhistas,,Direitos Trabalhistas Defenda seus direitos!,,,,,,,,
Direitos Trabalhistas,direito-trabalhista-d0435,65c413ba50d21de863daa711,6552987bfd4a5980b0cc5b42,65c4160d24978d16f26c5858,Wed Feb 07 2024 23:45:17 GMT+0000 (Coordinated Universal Time),Wed Feb 07 2024 23:45:17 GMT+0000 (Coordinated Universal Time),Wed Feb 07 2024 23:46:49 GMT+0000 (Coordinated Universal Time),Direitos Trabalhistas,,Direitos Trabalhistas Defenda seus direitos!,,,,,,,,
Direitos Trabalhistas das Empregadas Domésticas e Diaristas,empregada-domestica,65c413ba50d21de863daa711,6552987bfd4a5980b0cc5b42,65c4160c14af8ba83def6c73,Wed Feb 07 2024 23:45:16 GMT+0000 (Coordinated Universal Time),Wed Feb 07 2024 23:45:16 GMT+0000 (Coordinated Universal Time),Wed Feb 07 2024 23:46:49 GMT+0000 (Coordinated Universal Time),Direitos Trabalhistas das Empregadas Domésticas e Diaristas,"Sabemos que as empregadas domésticas muitas vezes enfrentam desafios únicos no local de trabalho. Seja por não receberem salários justos, por trabalharem horas extras não remuneradas, ou por terem seus direitos básicos ignorados, essas situações podem fazer com que você se sinta desvalorizada e impotente.",Direitos Trabalhistas das Empregadas Domésticas e Diaristas,Empregada Doméstica,ADVOGADO PARA EMPREGADA DOMÉSTICA,"Sabemos que as empregadas domésticas muitas vezes enfrentam desafios únicos no local de trabalho. Seja por não receberem salários justos, por trabalharem horas extras não remuneradas, ou por terem seus direitos básicos ignorados, essas situações podem fazer com que você se sinta desvalorizada e impotente.","É empregada doméstica e enfrenta desafios no trabalho? Conecte-se com advogados especializados em direitos trabalhistas para empregadas domésticas através de nossa plataforma. Aqui, você pode encontrar ajuda para questões como horas extras não remuneradas, férias não concedidas, ou condições inadequadas de trabalho. Acesse <advogados online> e descubra seus direitos.",Quem trabalha como empregada doméstica pode ter direitos não calculados nas verbas rescisórias. Tire suas dúvidas e converse com os melhores advogados em causas trabalhistas para empregada doméstica.,,,
Fale com Advogados Gratuitamente,falar-com-advogado,65c413ba50d21de863daa711,6552987bfd4a5980b0cc5b42,65c4160b40244f72db7f9c03,Wed Feb 07 2024 23:45:15 GMT+0000 (Coordinated Universal Time),Wed Feb 07 2024 23:45:15 GMT+0000 (Coordinated Universal Time),Wed Feb 07 2024 23:46:49 GMT+0000 (Coordinated Universal Time),Fale com Advogados Gratuitamente,,Fale com Advogados Gratuitamente Defenda seus direitos!,,,,,,,,
Você foi Demitido Injustamente? Seu Contrato de Trabalho Foi Quebrado?,fui-demitido,65c413ba50d21de863daa711,6552987bfd4a5980b0cc5b42,65c4160bdde4516776e6ea6d,Wed Feb 07 2024 23:45:15 GMT+0000 (Coordinated Universal Time),Wed Feb 07 2024 23:45:15 GMT+0000 (Coordinated Universal Time),Wed Feb 07 2024 23:46:49 GMT+0000 (Coordinated Universal Time),Você foi Demitido Injustamente? Seu Contrato de Trabalho Foi Quebrado?,,Você foi Demitido Injustamente? Seu Contrato de Trabalho Foi Quebrado? Defenda seus direitos!,,,,,,,,
Buscando Direitos Trabalhistas para Grávidas?,gravida,65c413ba50d21de863daa711,6552987bfd4a5980b0cc5b42,65c4160cecc46de6022d91e8,Wed Feb 07 2024 23:45:16 GMT+0000 (Coordinated Universal Time),Wed Feb 07 2024 23:45:16 GMT+0000 (Coordinated Universal Time),Wed Feb 07 2024 23:46:49 GMT+0000 (Coordinated Universal Time),Buscando Direitos Trabalhistas para Grávidas?,,Buscando Direitos Trabalhistas para Grávidas? Defenda seus direitos!,,,,,,,,
Indenização Trabalhista,indenizacao,65c413ba50d21de863daa711,6552987bfd4a5980b0cc5b42,65c4160a8ae728e6e3f5b5fc,Wed Feb 07 2024 23:45:14 GMT+0000 (Coordinated Universal Time),Wed Feb 07 2024 23:45:14 GMT+0000 (Coordinated Universal Time),Wed Feb 07 2024 23:46:49 GMT+0000 (Coordinated Universal Time),Indenização Trabalhista,,Indenização Trabalhista Defenda seus direitos!,,,,,,,,
Insalubridade no Trabalho,insalubridade,65c413ba50d21de863daa711,6552987bfd4a5980b0cc5b42,65c4160d7f4fa5f0cdce148c,Wed Feb 07 2024 23:45:17 GMT+0000 (Coordinated Universal Time),Wed Feb 07 2024 23:45:17 GMT+0000 (Coordinated Universal Time),Wed Feb 07 2024 23:46:49 GMT+0000 (Coordinated Universal Time),Insalubridade no Trabalho,"No ambiente de trabalho, sua saúde e bem-estar são prioridades. Na Quero Direito, compreendemos os desafios que os trabalhadores enfrentam quando expostos a condições insalubres. Nossa missão é garantir que você conheça seus direitos e receba o suporte necessário para lidar com questões de insalubridade.‍Nossos advogados especializados em direito trabalhista têm ampla experiência em lidar com casos de insalubridade no trabalho.",Insalubridade no Trabalho,,,"No ambiente de trabalho, sua saúde e bem-estar são prioridades. Na Quero Direito, compreendemos os desafios que os trabalhadores enfrentam quando expostos a condições insalubres. Nossa missão é garantir que você conheça seus direitos e receba o suporte necessário para lidar com questões de insalubridade.‍Nossos advogados especializados em direito trabalhista têm ampla experiência em lidar com casos de insalubridade no trabalho.",,,,,
Justa Causa,justa-causa,65c413ba50d21de863daa711,6552987bfd4a5980b0cc5b42,65c4160b8aec62f88462b7f6,Wed Feb 07 2024 23:45:15 GMT+0000 (Coordinated Universal Time),Wed Feb 07 2024 23:45:15 GMT+0000 (Coordinated Universal Time),Wed Feb 07 2024 23:46:49 GMT+0000 (Coordinated Universal Time),Justa Causa,,Justa Causa Defenda seus direitos!,,,,,,,,
Problemas com Seu Chefe?,meu-chefe,65c413ba50d21de863daa711,6552987bfd4a5980b0cc5b42,65c4160a1c3d95514ad4e8e2,Wed Feb 07 2024 23:45:14 GMT+0000 (Coordinated Universal Time),Wed Feb 07 2024 23:45:14 GMT+0000 (Coordinated Universal Time),Wed Feb 07 2024 23:46:49 GMT+0000 (Coordinated Universal Time),Problemas com Seu Chefe?,,Problemas com Seu Chefe? Defenda seus direitos!,,,,,,,,
Problemas com Seu Chefe?,meu-chefe-73cd1,65c413ba50d21de863daa711,6552987bfd4a5980b0cc5b42,65c4160d6e03b86e2817bccd,Wed Feb 07 2024 23:45:17 GMT+0000 (Coordinated Universal Time),Wed Feb 07 2024 23:45:17 GMT+0000 (Coordinated Universal Time),Wed Feb 07 2024 23:46:49 GMT+0000 (Coordinated Universal Time),Problemas com Seu Chefe?,,Problemas com Seu Chefe? Defenda seus direitos!,,,,,,,,
Direitos Trabalhistas do Motoboy,motoboy,65c413ba50d21de863daa711,6552987bfd4a5980b0cc5b42,65c4160c50450f1180458fdc,Wed Feb 07 2024 23:45:16 GMT+0000 (Coordinated Universal Time),Thu Feb 08 2024 13:24:07 GMT+0000 (Coordinated Universal Time),Thu Feb 08 2024 13:25:35 GMT+0000 (Coordinated Universal Time),Direitos Trabalhistas do Motoboy,"Se você é um motoboy e enfrenta desafios nas ruas e no local de trabalho, saiba que estamos aqui para ajudá-lo a proteger seus direitos e garantir um trabalho seguro. Na Quero Direito, oferecemos assistência em casos de horas extras não remuneradas, acidentes de trânsito, condições de trabalho precárias e muito mais. Defendemos seus direitos enquanto você mantém a cidade em movimento.",Direitos Trabalhistas do Motoboy,Vigilante,ADVOGADO PARA VIGILANTE,"Se você é um motoboy e enfrenta desafios nas ruas e no local de trabalho, saiba que estamos aqui para ajudá-lo a proteger seus direitos e garantir um trabalho seguro. Na Quero Direito, oferecemos assistência em casos de horas extras não remuneradas, acidentes de trânsito, condições de trabalho precárias e muito mais. Defendemos seus direitos enquanto você mantém a cidade em movimento.","Trabalha como vigilante e tem problemas trabalhistas? Use nossa plataforma para encontrar advogados com experiência em direitos de vigilantes. Se está lidando com carga horária excessiva, falta de equipamento de segurança ou questões contratuais, podemos ajudar. Conecte-se agora com <advogados online> e informe-se sobre seus direitos.",Quem trabalha como vigilante pode ter direitos que não são calculados nas verbas rescisórias. Tire suas dúvidas e converse com os melhores advogados em causas trabalhistas para vigilantes.,"<p id="""">Se você é um motoboy e enfrenta desafios nas ruas e no local de trabalho, saiba que estamos aqui para ajudá-lo a proteger seus direitos e garantir um trabalho seguro. Na Quero Direito, oferecemos assistência em casos de horas extras não remuneradas, acidentes de trânsito, condições de trabalho precárias e muito mais. Defendemos seus direitos enquanto você mantém a cidade em movimento.</p><p id=""""><a href=""http://www.google.com.br"">Google</a>‍</p>","<p id="""">Trabalha como vigilante e tem problemas trabalhistas? Use nossa plataforma para encontrar advogados com experiência em direitos de vigilantes. Se está lidando com carga horária excessiva, falta de equipamento de segurança ou questões contratuais, podemos ajudar. Conecte-se agora com &lt;advogados online&gt; e informe-se sobre seus direitos.</p><p id=""""><a href=""http://www.google.com.br"">Google</a>‍</p>","<p id="""">Quem trabalha como vigilante pode ter direitos que não são calculados nas verbas rescisórias. Tire suas dúvidas e converse com os melhores advogados em causas trabalhistas para vigilantes.</p><p id=""""><a href=""http://www.google.com.br"">Google</a>‍</p>"
Periculosidade no Trabalho,periculosidade,65c413ba50d21de863daa711,6552987bfd4a5980b0cc5b42,65c4160dc0d0915420496cc5,Wed Feb 07 2024 23:45:17 GMT+0000 (Coordinated Universal Time),Wed Feb 07 2024 23:45:17 GMT+0000 (Coordinated Universal Time),Wed Feb 07 2024 23:46:49 GMT+0000 (Coordinated Universal Time),Periculosidade no Trabalho,"A periculosidade no trabalho refere-se a condições laborais que expõem os trabalhadores a riscos significativos para sua saúde e segurança. Isso pode incluir exposição a substâncias químicas perigosas, eletricidade, inflamáveis, ruído excessivo, entre outros perigos.‍Nossos advogados especializados em direito trabalhista têm ampla experiência em lidar com casos de insalubridade no trabalho.",Periculosidade no Trabalho,,,"A periculosidade no trabalho refere-se a condições laborais que expõem os trabalhadores a riscos significativos para sua saúde e segurança. Isso pode incluir exposição a substâncias químicas perigosas, eletricidade, inflamáveis, ruído excessivo, entre outros perigos.‍Nossos advogados especializados em direito trabalhista têm ampla experiência em lidar com casos de insalubridade no trabalho.",,,,,
Processar Empresa,processar,65c413ba50d21de863daa711,6552987bfd4a5980b0cc5b42,65c4160b841b21b1133c109a,Wed Feb 07 2024 23:45:15 GMT+0000 (Coordinated Universal Time),Wed Feb 07 2024 23:45:15 GMT+0000 (Coordinated Universal Time),Wed Feb 07 2024 23:46:49 GMT+0000 (Coordinated Universal Time),Processar Empresa,,Processar Empresa Defenda seus direitos!,,,,,,,,
Quebra de Contrato,quebra-de-contrato,65c413ba50d21de863daa711,6552987bfd4a5980b0cc5b42,65c4160c797d1ab0b88715d1,Wed Feb 07 2024 23:45:16 GMT+0000 (Coordinated Universal Time),Wed Feb 07 2024 23:45:16 GMT+0000 (Coordinated Universal Time),Wed Feb 07 2024 23:46:49 GMT+0000 (Coordinated Universal Time),Quebra de Contrato,,Quebra de Contrato Defenda seus direitos!,,,,,,,,
Trabalho sem Carteira Assinada,trabalho-sem-carteira-assinada,65c413ba50d21de863daa711,6552987bfd4a5980b0cc5b42,65c4160c467b848333791fe6,Wed Feb 07 2024 23:45:16 GMT+0000 (Coordinated Universal Time),Wed Feb 07 2024 23:45:16 GMT+0000 (Coordinated Universal Time),Wed Feb 07 2024 23:46:49 GMT+0000 (Coordinated Universal Time),Trabalho sem Carteira Assinada,"Trabalha sem carteira assinada e enfrenta desafios no ambiente de trabalho? A Quero Direito está aqui para apoiá-lo, fornecendo orientação e proteção para seus direitos, mesmo em situações informais de emprego.",Trabalho sem Carteira Assinada,,,"Trabalha sem carteira assinada e enfrenta desafios no ambiente de trabalho? A Quero Direito está aqui para apoiá-lo, fornecendo orientação e proteção para seus direitos, mesmo em situações informais de emprego.",,,,,
Direitos Trabalhistas de  Vigilantes e Seguranças,vigilantes-segurancas,65c413ba50d21de863daa711,6552987bfd4a5980b0cc5b42,65c4160c472c5aa5237b22f9,Wed Feb 07 2024 23:45:16 GMT+0000 (Coordinated Universal Time),Wed Feb 07 2024 23:45:16 GMT+0000 (Coordinated Universal Time),Wed Feb 07 2024 23:46:49 GMT+0000 (Coordinated Universal Time),Direitos Trabalhistas de  Vigilantes e Seguranças,"Se você é um vigilante ou segurança e enfrenta desafios no local de trabalho, saiba que estamos aqui para ajudá-lo a proteger seus direitos e garantir tratamento justo. Na Quero Direito, oferecemos assistência em casos de horas extras não remuneradas, jornada irregular, riscos ocupacionais e muito mais.",Direitos Trabalhistas de  Vigilantes e Seguranças,Auxiliar de Limpeza,ADVOGADO PARA AUXILIAR DE LIMPEZA,"Se você é um vigilante ou segurança e enfrenta desafios no local de trabalho, saiba que estamos aqui para ajudá-lo a proteger seus direitos e garantir tratamento justo. Na Quero Direito, oferecemos assistência em casos de horas extras não remuneradas, jornada irregular, riscos ocupacionais e muito mais.","É auxiliar de limpeza e encontra problemas no ambiente de trabalho? Conecte-se com advogados especializados em direitos trabalhistas para auxiliares de limpeza na nossa plataforma, prontos para tratar questões como jornadas extenuantes e falta de segurança e higiene. Descubra seus direitos em <advogados online>.",Quem trabalha como auxiliar de limpeza pode ter direitos não contemplados nas verbas rescisórias. Tire suas dúvidas e fale com os melhores advogados em causas trabalhistas para auxiliares de limpeza.,,,
